{
  "schema_version": "1.0",
  "clock_domains": [
    "manual:s2s-interrupt"
  ],
  "completeness": "complete",
  "dropped_total": 0,
  "dropped_critical": 0,
  "events": [
    {
      "schema_version": "1.0",
      "event_id": "evt_000000",
      "session_id": "sess_s2s",
      "turn_id": "turn_s2s_interrupt",
      "span_id": "span_turn",
      "component": "turn",
      "name": "turn.started",
      "timestamp_ns": 0,
      "clock_domain": "manual:s2s-interrupt",
      "sequence": 0,
      "producer_id": "s2s-demo"
    },
    {
      "schema_version": "1.0",
      "event_id": "evt_000001",
      "session_id": "sess_s2s",
      "turn_id": "turn_s2s_interrupt",
      "span_id": "span_vad",
      "component": "vad",
      "name": "vad.speech_ended",
      "timestamp_ns": 50000000,
      "clock_domain": "manual:s2s-interrupt",
      "sequence": 1,
      "producer_id": "s2s-demo",
      "parent_span_id": "span_turn"
    },
    {
      "schema_version": "1.0",
      "event_id": "evt_000002",
      "session_id": "sess_s2s",
      "turn_id": "turn_s2s_interrupt",
      "span_id": "span_stt",
      "component": "stt",
      "name": "stt.started",
      "timestamp_ns": 55000000,
      "clock_domain": "manual:s2s-interrupt",
      "sequence": 0,
      "parent_span_id": "span_turn"
    },
    {
      "schema_version": "1.0",
      "event_id": "evt_000003",
      "session_id": "sess_s2s",
      "turn_id": "turn_s2s_interrupt",
      "span_id": "span_stt",
      "component": "stt",
      "name": "stt.completed",
      "timestamp_ns": 280000000,
      "clock_domain": "manual:s2s-interrupt",
      "sequence": 2,
      "producer_id": "s2s-demo",
      "parent_span_id": "span_turn",
      "attributes": {
        "backend": "s2s-demo"
      }
    },
    {
      "schema_version": "1.0",
      "event_id": "evt_000004",
      "session_id": "sess_s2s",
      "turn_id": "turn_s2s_interrupt",
      "span_id": "span_llm",
      "component": "llm",
      "name": "llm.started",
      "timestamp_ns": 290000000,
      "clock_domain": "manual:s2s-interrupt",
      "sequence": 1,
      "parent_span_id": "span_turn"
    },
    {
      "schema_version": "1.0",
      "event_id": "evt_000005",
      "session_id": "sess_s2s",
      "turn_id": "turn_s2s_interrupt",
      "span_id": "span_llm",
      "component": "llm",
      "name": "llm.first_token",
      "timestamp_ns": 450000000,
      "clock_domain": "manual:s2s-interrupt",
      "sequence": 3,
      "producer_id": "s2s-demo",
      "parent_span_id": "span_turn"
    },
    {
      "schema_version": "1.0",
      "event_id": "evt_000006",
      "session_id": "sess_s2s",
      "turn_id": "turn_s2s_interrupt",
      "span_id": "span_tts",
      "component": "tts",
      "name": "tts.started",
      "timestamp_ns": 460000000,
      "clock_domain": "manual:s2s-interrupt",
      "sequence": 2,
      "parent_span_id": "span_turn"
    },
    {
      "schema_version": "1.0",
      "event_id": "evt_000007",
      "session_id": "sess_s2s",
      "turn_id": "turn_s2s_interrupt",
      "span_id": "span_tts",
      "component": "tts",
      "name": "tts.first_audio",
      "timestamp_ns": 620000000,
      "clock_domain": "manual:s2s-interrupt",
      "sequence": 4,
      "producer_id": "s2s-demo",
      "parent_span_id": "span_turn"
    },
    {
      "schema_version": "1.0",
      "event_id": "evt_000008",
      "session_id": "sess_s2s",
      "turn_id": "turn_s2s_interrupt",
      "span_id": "span_playback",
      "component": "playback",
      "name": "playback.started",
      "timestamp_ns": 700000000,
      "clock_domain": "manual:s2s-interrupt",
      "sequence": 3,
      "parent_span_id": "span_turn"
    },
    {
      "schema_version": "1.0",
      "event_id": "evt_000009",
      "session_id": "sess_s2s",
      "turn_id": "turn_s2s_interrupt",
      "span_id": "span_vad",
      "component": "vad",
      "name": "vad.speech_started",
      "timestamp_ns": 900000000,
      "clock_domain": "manual:s2s-interrupt",
      "sequence": 5,
      "producer_id": "s2s-demo",
      "parent_span_id": "span_turn",
      "attributes": {
        "barge_in": true
      }
    },
    {
      "schema_version": "1.0",
      "event_id": "evt_000010",
      "session_id": "sess_s2s",
      "turn_id": "turn_s2s_interrupt",
      "span_id": "span_turn",
      "component": "turn",
      "name": "cancel.requested",
      "timestamp_ns": 910000000,
      "clock_domain": "manual:s2s-interrupt",
      "sequence": 6,
      "producer_id": "s2s-demo"
    },
    {
      "schema_version": "1.0",
      "event_id": "evt_000011",
      "session_id": "sess_s2s",
      "turn_id": "turn_s2s_interrupt",
      "span_id": "span_turn",
      "component": "turn",
      "name": "cancel.acknowledged",
      "timestamp_ns": 920000000,
      "clock_domain": "manual:s2s-interrupt",
      "sequence": 7,
      "producer_id": "s2s-demo"
    },
    {
      "schema_version": "1.0",
      "event_id": "evt_000012",
      "session_id": "sess_s2s",
      "turn_id": "turn_s2s_interrupt",
      "span_id": "span_llm",
      "component": "llm",
      "name": "llm.cancelled",
      "timestamp_ns": 940000000,
      "clock_domain": "manual:s2s-interrupt",
      "sequence": 8,
      "producer_id": "s2s-demo",
      "parent_span_id": "span_turn"
    },
    {
      "schema_version": "1.0",
      "event_id": "evt_000013",
      "session_id": "sess_s2s",
      "turn_id": "turn_s2s_interrupt",
      "span_id": "span_tts",
      "component": "tts",
      "name": "tts.cancelled",
      "timestamp_ns": 950000000,
      "clock_domain": "manual:s2s-interrupt",
      "sequence": 9,
      "producer_id": "s2s-demo",
      "parent_span_id": "span_turn"
    },
    {
      "schema_version": "1.0",
      "event_id": "evt_000014",
      "session_id": "sess_s2s",
      "turn_id": "turn_s2s_interrupt",
      "span_id": "span_playback",
      "component": "playback",
      "name": "playback.completed",
      "timestamp_ns": 980000000,
      "clock_domain": "manual:s2s-interrupt",
      "sequence": 10,
      "producer_id": "s2s-demo",
      "parent_span_id": "span_turn"
    },
    {
      "schema_version": "1.0",
      "event_id": "evt_000015",
      "session_id": "sess_s2s",
      "turn_id": "turn_s2s_interrupt",
      "span_id": "span_turn",
      "component": "turn",
      "name": "turn.cancelled",
      "timestamp_ns": 1000000000,
      "clock_domain": "manual:s2s-interrupt",
      "sequence": 11,
      "producer_id": "s2s-demo"
    }
  ]
}
